{
    "description": "Unit test for object detection platforms using GPU training.",
    "format_version": "0.2.0",
    "models": [
        {
            "name": "text_detect/dt2/ut",
            "tests": [
                {
                    "dataset_path": "data_sets/text_detect_val.json",
                    "tag": "ut_val_dt2"
                }
            ]
        },
        {
            "name": "text_detect/mmd/ut",
            "tests": [
                {
                    "dataset_path": "data_sets/text_detect_val.json",
                    "tag": "ut_val_mmd"
                }
            ]
        }
    ],
    "reports": [
        {
            "description": "Builds PR plots for the dt2 model.",
            "fqcn": "juneberry.reporting.pr.PRCurve",
            "kwargs": {
                "iou": 0.5,
                "output_dir": "ut_val_dt2"
            },
            "tests": [
                {
                    "tag": "ut_val_dt2"
                }
        ]
        },
        {
            "description": "Builds PR plots for the mmd model.",
            "fqcn": "juneberry.reporting.pr.PRCurve",
            "kwargs": {
                "iou": 0.5,
                "output_dir": "ut_val_mmd"
            },
            "tests": [
                {
                    "tag": "ut_val_mmd"
                }
            ]
        },
        {
            "description": "Combines PR curves for both platforms on the same plot. Slight increase to IoU.",
            "fqcn": "juneberry.reporting.pr.PRCurve",
            "kwargs": {
                "iou": 0.55,
                "output_dir": "ut_val_combined"
            },
            "tests": [
                {
                    "tag": "ut_val_dt2"
                },
                {
                    "tag": "ut_val_mmd"
                }
            ]
        },
        {
            "description": "System OD Test Summary.md",
            "fqcn": "juneberry.reporting.summary.Summary",
            "kwargs": {
                "csv_filename": "OD System Test Summary.csv",
                "md_filename": "System OD Test Summary.md"
            }
        }
    ],
    "timestamp": "2022-04-15T07:40:00"
}